,nick,contents,recomm,unrecomm,title,play,like,reple_count,episode
1259,골든,역시 최진혁 매너 멋지네요!!!!!,27,25,[메이킹] 커플티 입고 캠핑 데이트..♡ (ft. 황후는 그냥 다 좋아♥),"재생수 173,230","1,133",245,22
1260,아기별,최진혁 배우 넘 멋지네요!!!  눈웃음 매력,27,24,[메이킹] 커플티 입고 캠핑 데이트..♡ (ft. 황후는 그냥 다 좋아♥),"재생수 173,230","1,133",245,22
1261,펭귄,"김순옥작가님 드라마중 남녀커플로는 가장 큰사랑을 받는 오써니,이혁 커플이네요~~^^",41,13,[메이킹] 커플티 입고 캠핑 데이트..♡ (ft. 황후는 그냥 다 좋아♥),"재생수 173,230","1,133",245,22
1262,아기별,최진혁 ❤❤❤❤,28,25,[메이킹] 커플티 입고 캠핑 데이트..♡ (ft. 황후는 그냥 다 좋아♥),"재생수 173,230","1,133",245,22
1263,으엑,오이!오이!52!,32,11,[메이킹] 커플티 입고 캠핑 데이트..♡ (ft. 황후는 그냥 다 좋아♥),"재생수 173,230","1,133",245,22
1264,엘럽,"개인적으로 민유라 메이킹도 궁금합니다.. 본체가 얼마나 매력둥이신데,,",22,5,[메이킹] 커플티 입고 캠핑 데이트..♡ (ft. 황후는 그냥 다 좋아♥),"재생수 173,230","1,133",245,22
1265,토리,최진혁 도복씬 넘 멋지다!!!,29,27,[메이킹] 커플티 입고 캠핑 데이트..♡ (ft. 황후는 그냥 다 좋아♥),"재생수 173,230","1,133",245,22
1266,현이찡,오이커플 케미 좋다 ㅠ,35,9,[메이킹] 커플티 입고 캠핑 데이트..♡ (ft. 황후는 그냥 다 좋아♥),"재생수 173,230","1,133",245,22
1267,토리,최진혁 역시 핵멋짐!!!!!,28,25,[메이킹] 커플티 입고 캠핑 데이트..♡ (ft. 황후는 그냥 다 좋아♥),"재생수 173,230","1,133",245,22
1268,삼각돌이,"메이킹 손꼽아기다렸는데...감사합니다^^ 오이, 오천 모두 케미가 정말 좋으세요~~ 촬영장 분위기도 훈훈해서 좋네요ㅎㅎ",23,4,[메이킹] 커플티 입고 캠핑 데이트..♡ (ft. 황후는 그냥 다 좋아♥),"재생수 173,230","1,133",245,22
1269,one love,순옥님..제발 이대로 가요~,24,10,[메이킹] 커플티 입고 캠핑 데이트..♡ (ft. 황후는 그냥 다 좋아♥),"재생수 173,230","1,133",245,22
1270,별명,52525252525252552252,34,10,[메이킹] 커플티 입고 캠핑 데이트..♡ (ft. 황후는 그냥 다 좋아♥),"재생수 173,230","1,133",245,22
1271,드라이플라워,장나라님 넘 커여워염 ㅠㅠ 우리 써니 사랑스럽고 예쁨ㅋ 신성록님 왜 이렇게 웃겨염 ㅋㅋㅋ 깨알 시계자랑 ㅋㅋㅋ 시계 궁금해서 더 보고 싶은데염 보라색 후드티 커플템 존예템❤❤ 저도 따라서 샀어여!!! 이혁써니 사랑해 내가 많이많이 사랑해! 명절날 선물 감사해염 이혁써니 메이킹 많이 주세욤!!!,43,10,[메이킹] 커플티 입고 캠핑 데이트..♡ (ft. 황후는 그냥 다 좋아♥),"재생수 173,230","1,133",245,22
1272,sky,써니 아빠 돈다발이 너무 작아서 화났어ㅋㅋ,32,5,[메이킹] 커플티 입고 캠핑 데이트..♡ (ft. 황후는 그냥 다 좋아♥),"재생수 173,230","1,133",245,22
1273,EVERYTHING,오이커플티 너무 잘어울린다♡♡,43,9,[메이킹] 커플티 입고 캠핑 데이트..♡ (ft. 황후는 그냥 다 좋아♥),"재생수 173,230","1,133",245,22
1274,무지개,최진혁 얼굴 보자마자 심장이ㅜ 너무 섹시하고 남자다움♥드라마 잘 보고 있어요^^,31,29,[메이킹] 커플티 입고 캠핑 데이트..♡ (ft. 황후는 그냥 다 좋아♥),"재생수 173,230","1,133",245,22
1275,ilililil,오이는 명약입니다. 썬혁 하세요,46,11,[메이킹] 커플티 입고 캠핑 데이트..♡ (ft. 황후는 그냥 다 좋아♥),"재생수 173,230","1,133",245,22
1276,이나,둘이 붙는 씬이 제일 재미있어요 자주 나와줘요,39,11,[메이킹] 커플티 입고 캠핑 데이트..♡ (ft. 황후는 그냥 다 좋아♥),"재생수 173,230","1,133",245,22
1277,violet,천우빈 존잘보스  웃는 눈 예뻐,30,31,[메이킹] 커플티 입고 캠핑 데이트..♡ (ft. 황후는 그냥 다 좋아♥),"재생수 173,230","1,133",245,22
1278,눈이온다,최진혁 너무 멋지다.보기만해도 설레인다,29,30,[메이킹] 커플티 입고 캠핑 데이트..♡ (ft. 황후는 그냥 다 좋아♥),"재생수 173,230","1,133",245,22
1279,조태자,오이가 답이다 ㄹㅇ.....,47,13,[메이킹] 커플티 입고 캠핑 데이트..♡ (ft. 황후는 그냥 다 좋아♥),"재생수 173,230","1,133",245,22
1280,아몬드,연기연습도 하셨으면 좋겠네요,17,21,[메이킹] 커플티 입고 캠핑 데이트..♡ (ft. 황후는 그냥 다 좋아♥),"재생수 173,230","1,133",245,22
1281,보타니컬가든,와 캠핑씬 메이킹 감사합니다!!!!! 황제전에서 씐난 마수리도 귀염,41,4,[메이킹] 커플티 입고 캠핑 데이트..♡ (ft. 황후는 그냥 다 좋아♥),"재생수 173,230","1,133",245,22
1282,고도를기다리며,오천 붙는씬 없어서 기대 안했는데 한장면이라도 주셔서 감사❤,26,38,[메이킹] 커플티 입고 캠핑 데이트..♡ (ft. 황후는 그냥 다 좋아♥),"재생수 173,230","1,133",245,22
1283,고구마라떼,최진혁 진짜 잘 생겼다♥,30,34,[메이킹] 커플티 입고 캠핑 데이트..♡ (ft. 황후는 그냥 다 좋아♥),"재생수 173,230","1,133",245,22
1284,이경희,오이  분위기  너무죠타♥♥♥,62,10,[메이킹] 커플티 입고 캠핑 데이트..♡ (ft. 황후는 그냥 다 좋아♥),"재생수 173,230","1,133",245,22
1285,오이가좋다고,써니 스텝들 도와주는거 역시 마음씨도 예뻐,47,5,[메이킹] 커플티 입고 캠핑 데이트..♡ (ft. 황후는 그냥 다 좋아♥),"재생수 173,230","1,133",245,22
1286,hub1****,천우빈 틈틈이 운동  멋지다 ㅠ  최진혁 존좋,33,33,[메이킹] 커플티 입고 캠핑 데이트..♡ (ft. 황후는 그냥 다 좋아♥),"재생수 173,230","1,133",245,22
1287,노랭이,오이 케미 쩌네 인기 많을만함,67,12,[메이킹] 커플티 입고 캠핑 데이트..♡ (ft. 황후는 그냥 다 좋아♥),"재생수 173,230","1,133",245,22
1288,이르,아잌ㅋㅋㅋ 한팀장님 총총 너무 귀여우셔ㅠㅠㅠ,38,3,[메이킹] 커플티 입고 캠핑 데이트..♡ (ft. 황후는 그냥 다 좋아♥),"재생수 173,230","1,133",245,22
1289,오이가좋다고,오이커플티입은거 cc같아 존잘존예 오늘도 역시 메이킹맛집이네 재밌다 깨알 집사님귀여우시고,60,8,[메이킹] 커플티 입고 캠핑 데이트..♡ (ft. 황후는 그냥 다 좋아♥),"재생수 173,230","1,133",245,22
1290,ehdr****,이렇게 반응 잘 알면서 제발 오이로 낚시  인질 하지 말아주세요,66,13,[메이킹] 커플티 입고 캠핑 데이트..♡ (ft. 황후는 그냥 다 좋아♥),"재생수 173,230","1,133",245,22
1291,푸른별,메이킹감사해요ㅠㅠ 오이커플위주 메이킹많이보고싶다ㅋㅋㅋ,59,7,[메이킹] 커플티 입고 캠핑 데이트..♡ (ft. 황후는 그냥 다 좋아♥),"재생수 173,230","1,133",245,22
1292,hitchhiker,52사랑해^^♥,62,9,[메이킹] 커플티 입고 캠핑 데이트..♡ (ft. 황후는 그냥 다 좋아♥),"재생수 173,230","1,133",245,22
1293,파랑새yo,만찢케미 오이커플 이쁘다.,62,10,[메이킹] 커플티 입고 캠핑 데이트..♡ (ft. 황후는 그냥 다 좋아♥),"재생수 173,230","1,133",245,22
1294,먼로,봤지? 봤냐?ㅋㅋㅋㅋㅋㅋㄱㄱㅋㅋㅋㅋ,48,5,[메이킹] 커플티 입고 캠핑 데이트..♡ (ft. 황후는 그냥 다 좋아♥),"재생수 173,230","1,133",245,22
1295,상추,오천,23,39,[메이킹] 커플티 입고 캠핑 데이트..♡ (ft. 황후는 그냥 다 좋아♥),"재생수 173,230","1,133",245,22
1296,상추,우빈 써니 ❤️❤️,23,38,[메이킹] 커플티 입고 캠핑 데이트..♡ (ft. 황후는 그냥 다 좋아♥),"재생수 173,230","1,133",245,22
1297,SYSJDW,이혁♥오써니 오이는 사랑입니다!,202,18,[메이킹] 커플티 입고 캠핑 데이트..♡ (ft. 황후는 그냥 다 좋아♥),"재생수 173,230","1,133",245,22
1298,오이,5252 오이오이 큐컴버큐컴버!!,214,18,[메이킹] 커플티 입고 캠핑 데이트..♡ (ft. 황후는 그냥 다 좋아♥),"재생수 173,230","1,133",245,22
1299,하늘,썸네일부터 오이커플이다  신성록님 입술쭉ㅋㅋㅋㅋㅋㅋㅋㅋ귀여워요 봤지?봤냐ㅋㅋ,298,23,[메이킹] 커플티 입고 캠핑 데이트..♡ (ft. 황후는 그냥 다 좋아♥),"재생수 173,230","1,133",245,22
1300,이경희,오이야  꽃길  걷자  이제♥♥♥♥,219,17,[메이킹] 커플티 입고 캠핑 데이트..♡ (ft. 황후는 그냥 다 좋아♥),"재생수 173,230","1,133",245,22
1301,커피코피뿜뿜,나라찡 귀엽다 성록형도 귀엽네ㅋㅋㅋㅋㅋㅋ 두분 나올때 좋음,46,5,[메이킹] 커플티 입고 캠핑 데이트..♡ (ft. 황후는 그냥 다 좋아♥),"재생수 173,230","1,133",245,22
1302,ehdr****,오이는 사랑입니다,301,26,[메이킹] 커플티 입고 캠핑 데이트..♡ (ft. 황후는 그냥 다 좋아♥),"재생수 173,230","1,133",245,22
1303,파란하늘,신성록 장나라 두분 케미넘좋아요ㅠㅠ  꼭 다음에 로코 찍어주세요  커플티입고 꽁냥꽁냥 좋고  진짜대학생커플느낌❤❤,477,31,[메이킹] 커플티 입고 캠핑 데이트..♡ (ft. 황후는 그냥 다 좋아♥),"재생수 173,230","1,133",245,22
1304,ehdr****,역시 메이킹도 혁 써니 태후가 나와야 재미있네요 소품 정리해주는 써니도 극 안에서도 밖에서도 최고입니다,41,6,[메이킹] 커플티 입고 캠핑 데이트..♡ (ft. 황후는 그냥 다 좋아♥),"재생수 173,230","1,133",245,22
1305,먼로,메이킹 꿀터진다 ㅠㅠㅠ 이혁좋아서미치게쒀,235,19,[메이킹] 커플티 입고 캠핑 데이트..♡ (ft. 황후는 그냥 다 좋아♥),"재생수 173,230","1,133",245,22
1306,별자리,오이는 보약길입니다 둘에게 행복을 52sz♡,312,24,[메이킹] 커플티 입고 캠핑 데이트..♡ (ft. 황후는 그냥 다 좋아♥),"재생수 173,230","1,133",245,22
1307,rlck****,한팀장님 뛰어오시는 거 귀여우시다 ㅋㅋㅋㅋㅋㅋㅋ,51,2,[메이킹] 커플티 입고 캠핑 데이트..♡ (ft. 황후는 그냥 다 좋아♥),"재생수 173,230","1,133",245,22
1308,식혜,오이케미 ㅜㅜㅜㅜ 미쳤어,334,27,[메이킹] 커플티 입고 캠핑 데이트..♡ (ft. 황후는 그냥 다 좋아♥),"재생수 173,230","1,133",245,22
1309,지미,이혁써니 케미 팡팡터지네요 요즘 황후의 품격은 이혁써니 보려구 봐요ㅠㅠㅠ 이제 보약길인거 맞죠? 순옥 오이 행복하게 해줘❤️,380,32,[메이킹] 커플티 입고 캠핑 데이트..♡ (ft. 황후는 그냥 다 좋아♥),"재생수 173,230","1,133",245,22
1310,파란하늘,이메이킹 기다렸는데 ㅠㅠ 이혁넘귀여워ㅋㅋㅋㅋㅋ혁써니 캠핑  데이트신 진짜좋다♥♥,590,35,[메이킹] 커플티 입고 캠핑 데이트..♡ (ft. 황후는 그냥 다 좋아♥),"재생수 173,230","1,133",245,22
1311,rlck****,오이 커플 너무 좋다!! 태후 봉사씬도 보고 싶어요 ㅠㅠㅠ,240,15,[메이킹] 커플티 입고 캠핑 데이트..♡ (ft. 황후는 그냥 다 좋아♥),"재생수 173,230","1,133",245,22
1312,00,으악 오이커플 케미 최고된다ㅠㅠ,502,32,[메이킹] 커플티 입고 캠핑 데이트..♡ (ft. 황후는 그냥 다 좋아♥),"재생수 173,230","1,133",245,22
1313,히히히,혁써니는 사랑입니다 오이!!!52!!!!!!,399,27,[메이킹] 커플티 입고 캠핑 데이트..♡ (ft. 황후는 그냥 다 좋아♥),"재생수 173,230","1,133",245,22
1314,123455,이혁 오써니 너무 좋다...,813,43,[메이킹] 커플티 입고 캠핑 데이트..♡ (ft. 황후는 그냥 다 좋아♥),"재생수 173,230","1,133",245,22
1315,소진 장공주,치,0,0,"이희진, 장나라에 격한 선전포고 “최진혁 건드리지 마!”","재생수 106,054",406,87,22
1316,소진 여황제,나!!!!!여황제야,2,0,"이희진, 장나라에 격한 선전포고 “최진혁 건드리지 마!”","재생수 106,054",406,87,22
1317,소진 여황제,야!!!!!비호감 이라고?,2,0,"이희진, 장나라에 격한 선전포고 “최진혁 건드리지 마!”","재생수 106,054",406,87,22
1318,소진 황태녀,치 내가싫다고?????,3,0,"이희진, 장나라에 격한 선전포고 “최진혁 건드리지 마!”","재생수 106,054",406,87,22
1319,카이트,지나치시네요 장공주마마..ㅠㅠㅠㅠ,2,2,"이희진, 장나라에 격한 선전포고 “최진혁 건드리지 마!”","재생수 106,054",406,87,22
1320,나르비카르 샤르슈안,난 소진공주 편임 오써니 영악한 년 소진공주가 순수하게 천대장 좋아한 거 알면서 천대장과 짜고 소진공주 이용해먹고 천대장이랑 계속 불륜관계 유지함 난 오써니 저 계집년 존나 역겨움,2,10,"이희진, 장나라에 격한 선전포고 “최진혁 건드리지 마!”","재생수 106,054",406,87,22
1321,라일락,소진공주 왕식이 아프단걸 알고 꺼내주는데 일조할듯,7,0,"이희진, 장나라에 격한 선전포고 “최진혁 건드리지 마!”","재생수 106,054",406,87,22
1322,박정은,이거보니깐 질투도 유전인가 남매가 쌍으로 질투하는게 너무...ㄷㄷ질투가아니라 걍 집착인듯,14,0,"이희진, 장나라에 격한 선전포고 “최진혁 건드리지 마!”","재생수 106,054",406,87,22
1323,잉,그애미에 그딸이지뭐  피가 어디로가나,5,2,"이희진, 장나라에 격한 선전포고 “최진혁 건드리지 마!”","재생수 106,054",406,87,22
1324,응애,"소진공주 집착 계속 나오는 이유가 있을 듯.. 써니가 아무리 아무 사이가 아니라 말해도 소진공주도 찝찝한게 있긴 있겠지.. 써니랑 천대장 서로 좋아하는 게 맞으니까. 역시 여자의 육감이란,,, (써니는 마음 숨기고 있는 거고)",10,7,"이희진, 장나라에 격한 선전포고 “최진혁 건드리지 마!”","재생수 106,054",406,87,22
1325,케로로 중사 뽀로로,장공주마마 그망 하세요!! 제가 대신 말할 게요 둘이 좋아해여,14,7,"이희진, 장나라에 격한 선전포고 “최진혁 건드리지 마!”","재생수 106,054",406,87,22
1326,과자먹고싶다,소진공주 예전으로 돌아와ㅠ,8,0,"이희진, 장나라에 격한 선전포고 “최진혁 건드리지 마!”","재생수 106,054",406,87,22
1327,tlstjfla509,폐하 지위 무엇... 거의 싸움말리는 남동생;;,13,1,"이희진, 장나라에 격한 선전포고 “최진혁 건드리지 마!”","재생수 106,054",406,87,22
1328,연예혁명,근데 좋아 하던 사람이 3개월 시한부라는걸 알면 ㅋ 살인자 집안에 딸인게 죄지 뭐..,12,1,"이희진, 장나라에 격한 선전포고 “최진혁 건드리지 마!”","재생수 106,054",406,87,22
1329,백영미,공주 비호감,15,0,"이희진, 장나라에 격한 선전포고 “최진혁 건드리지 마!”","재생수 106,054",406,87,22
1330,나무아미아멘,소진공주는 우빈써니 사이에 끼어든 감초 역할이라 그닥 위협적인 인물은 아닙니다 웃게하는 인물일뿐이죠 단지 여기선 써니에 대한 이혁의 신뢰를 흔드는데 가담하는 장면이라 독하게 보이는거임,17,2,"이희진, 장나라에 격한 선전포고 “최진혁 건드리지 마!”","재생수 106,054",406,87,22
1331,김민채,아니 지가 좋아했고 우빈이는 공주 관심이 없는데 왜 저럼?,23,2,"이희진, 장나라에 격한 선전포고 “최진혁 건드리지 마!”","재생수 106,054",406,87,22
1332,오드리햇반,다들 미쳐가는듯 ㅠㅠ,17,1,"이희진, 장나라에 격한 선전포고 “최진혁 건드리지 마!”","재생수 106,054",406,87,22
1333,우지연,소진공주가 모든 사실을 알면 어떻게 할까 궁금하네요,14,0,"이희진, 장나라에 격한 선전포고 “최진혁 건드리지 마!”","재생수 106,054",406,87,22
1334,viol****,이희진 연기할때 목 핏대가 터질것처럼우글우글대서 신경쓰임~,5,9,"이희진, 장나라에 격한 선전포고 “최진혁 건드리지 마!”","재생수 106,054",406,87,22
1335,소진 장공주,치,0,0,"이희진, 장나라에 격한 선전포고 “최진혁 건드리지 마!”","재생수 106,054",406,87,22
1336,소진 여황제,나!!!!!여황제야,2,0,"이희진, 장나라에 격한 선전포고 “최진혁 건드리지 마!”","재생수 106,054",406,87,22
1337,소진 여황제,야!!!!!비호감 이라고?,2,0,"이희진, 장나라에 격한 선전포고 “최진혁 건드리지 마!”","재생수 106,054",406,87,22
1338,소진 황태녀,치 내가싫다고?????,3,0,"이희진, 장나라에 격한 선전포고 “최진혁 건드리지 마!”","재생수 106,054",406,87,22
1339,카이트,지나치시네요 장공주마마..ㅠㅠㅠㅠ,2,2,"이희진, 장나라에 격한 선전포고 “최진혁 건드리지 마!”","재생수 106,054",406,87,22
1340,나르비카르 샤르슈안,난 소진공주 편임 오써니 영악한 년 소진공주가 순수하게 천대장 좋아한 거 알면서 천대장과 짜고 소진공주 이용해먹고 천대장이랑 계속 불륜관계 유지함 난 오써니 저 계집년 존나 역겨움,2,10,"이희진, 장나라에 격한 선전포고 “최진혁 건드리지 마!”","재생수 106,054",406,87,22
1341,라일락,소진공주 왕식이 아프단걸 알고 꺼내주는데 일조할듯,7,0,"이희진, 장나라에 격한 선전포고 “최진혁 건드리지 마!”","재생수 106,054",406,87,22
1342,박정은,이거보니깐 질투도 유전인가 남매가 쌍으로 질투하는게 너무...ㄷㄷ질투가아니라 걍 집착인듯,14,0,"이희진, 장나라에 격한 선전포고 “최진혁 건드리지 마!”","재생수 106,054",406,87,22
1343,잉,그애미에 그딸이지뭐  피가 어디로가나,5,2,"이희진, 장나라에 격한 선전포고 “최진혁 건드리지 마!”","재생수 106,054",406,87,22
1344,응애,"소진공주 집착 계속 나오는 이유가 있을 듯.. 써니가 아무리 아무 사이가 아니라 말해도 소진공주도 찝찝한게 있긴 있겠지.. 써니랑 천대장 서로 좋아하는 게 맞으니까. 역시 여자의 육감이란,,, (써니는 마음 숨기고 있는 거고)",10,7,"이희진, 장나라에 격한 선전포고 “최진혁 건드리지 마!”","재생수 106,054",406,87,22
1345,케로로 중사 뽀로로,장공주마마 그망 하세요!! 제가 대신 말할 게요 둘이 좋아해여,14,7,"이희진, 장나라에 격한 선전포고 “최진혁 건드리지 마!”","재생수 106,054",406,87,22
1346,과자먹고싶다,소진공주 예전으로 돌아와ㅠ,8,0,"이희진, 장나라에 격한 선전포고 “최진혁 건드리지 마!”","재생수 106,054",406,87,22
1347,tlstjfla509,폐하 지위 무엇... 거의 싸움말리는 남동생;;,13,1,"이희진, 장나라에 격한 선전포고 “최진혁 건드리지 마!”","재생수 106,054",406,87,22
1348,연예혁명,근데 좋아 하던 사람이 3개월 시한부라는걸 알면 ㅋ 살인자 집안에 딸인게 죄지 뭐..,12,1,"이희진, 장나라에 격한 선전포고 “최진혁 건드리지 마!”","재생수 106,054",406,87,22
1349,백영미,공주 비호감,15,0,"이희진, 장나라에 격한 선전포고 “최진혁 건드리지 마!”","재생수 106,054",406,87,22
1350,나무아미아멘,소진공주는 우빈써니 사이에 끼어든 감초 역할이라 그닥 위협적인 인물은 아닙니다 웃게하는 인물일뿐이죠 단지 여기선 써니에 대한 이혁의 신뢰를 흔드는데 가담하는 장면이라 독하게 보이는거임,17,2,"이희진, 장나라에 격한 선전포고 “최진혁 건드리지 마!”","재생수 106,054",406,87,22
1351,김민채,아니 지가 좋아했고 우빈이는 공주 관심이 없는데 왜 저럼?,23,2,"이희진, 장나라에 격한 선전포고 “최진혁 건드리지 마!”","재생수 106,054",406,87,22
1352,오드리햇반,다들 미쳐가는듯 ㅠㅠ,17,1,"이희진, 장나라에 격한 선전포고 “최진혁 건드리지 마!”","재생수 106,054",406,87,22
1353,우지연,소진공주가 모든 사실을 알면 어떻게 할까 궁금하네요,14,0,"이희진, 장나라에 격한 선전포고 “최진혁 건드리지 마!”","재생수 106,054",406,87,22
1354,viol****,이희진 연기할때 목 핏대가 터질것처럼우글우글대서 신경쓰임~,5,9,"이희진, 장나라에 격한 선전포고 “최진혁 건드리지 마!”","재생수 106,054",406,87,22
1355,yesmom,엄마로부터  제대로 된 사랑을  못받고  자라서  황제:왕태제:장공주 다 너무 불쌍합니다~~그래서  좋아하는  사람이  생기면  집착하나봐요~~,15,0,"이희진, 장나라에 격한 선전포고 “최진혁 건드리지 마!”","재생수 106,054",406,87,22
1356,xyjkmn,여기서 오써니가 제일 예쁘네,13,0,"이희진, 장나라에 격한 선전포고 “최진혁 건드리지 마!”","재생수 106,054",406,87,22
1357,탠저린,소진공주가 이혼 2번한 이유가 납득가능하다,22,1,"이희진, 장나라에 격한 선전포고 “최진혁 건드리지 마!”","재생수 106,054",406,87,22
1358,안뇽,소진공주 오늘 좀 싫어졌지만 그래도 불쌍해...,15,4,"이희진, 장나라에 격한 선전포고 “최진혁 건드리지 마!”","재생수 106,054",406,87,22
1359,카이트,장공주 개오바..짜증,15,3,"이희진, 장나라에 격한 선전포고 “최진혁 건드리지 마!”","재생수 106,054",406,87,22
1360,한강9,이희진 표정 너무 웃김 ㅋㅋㅋㅋ,16,0,"이희진, 장나라에 격한 선전포고 “최진혁 건드리지 마!”","재생수 106,054",406,87,22
1361,수연님,소진공주 무조건 소리만 지르네  집착 무섭다,20,0,"이희진, 장나라에 격한 선전포고 “최진혁 건드리지 마!”","재생수 106,054",406,87,22
1362,수연님,소진이도 태후랑 똑같네,19,1,"이희진, 장나라에 격한 선전포고 “최진혁 건드리지 마!”","재생수 106,054",406,87,22
1363,ging,"이미 선을 넘었음 저번주부터 , 사랑아니고 집착임 내가 천우빈이라면 있던 조금의 정도 소멸",33,0,"이희진, 장나라에 격한 선전포고 “최진혁 건드리지 마!”","재생수 106,054",406,87,22
1364,후늬,그 엄마의 그 딸이구먼. 그나저나 이희진 연기 잘한다잉~,24,1,"이희진, 장나라에 격한 선전포고 “최진혁 건드리지 마!”","재생수 106,054",406,87,22
1365,안녕하세요,근데 갠적으로 연기 ㅂㄹ..,11,4,"이희진, 장나라에 격한 선전포고 “최진혁 건드리지 마!”","재생수 106,054",406,87,22
1366,srhn****,베이비복스ㅎ,10,0,"이희진, 장나라에 격한 선전포고 “최진혁 건드리지 마!”","재생수 106,054",406,87,22
1367,Usagi,원래 질투하는 여자가 매력꽝이라고 하죠,9,4,"이희진, 장나라에 격한 선전포고 “최진혁 건드리지 마!”","재생수 106,054",406,87,22
1368,an,근데 솔직히 말하면 소진공주 촉이 매우 좋음.. 썸타는것도 사실이고 마음 이용하는것도 사실임,28,2,"이희진, 장나라에 격한 선전포고 “최진혁 건드리지 마!”","재생수 106,054",406,87,22
1369,jjh4****,장공주좀 치워주세요 젭알....ㅜ,18,1,"이희진, 장나라에 격한 선전포고 “최진혁 건드리지 마!”","재생수 106,054",406,87,22
1370,두치와뿌꾸,소진공주 안되긴 안됐지만..그래도 오써니황후한테 왜구래여 냅둬..괜히 좋아한다는 오해샀어,19,0,"이희진, 장나라에 격한 선전포고 “최진혁 건드리지 마!”","재생수 106,054",406,87,22
1371,youy****,결국 여기 왕실 가족은 모두 내 마음을 알고 싶다고 자신의 것만 주장,14,1,"이희진, 장나라에 격한 선전포고 “최진혁 건드리지 마!”","재생수 106,054",406,87,22
1372,melon,소진공주여 써니건드리지마요,18,1,"이희진, 장나라에 격한 선전포고 “최진혁 건드리지 마!”","재생수 106,054",406,87,22
1373,햄찌,오써니가 천대장 안좋아하는데 장공주왜그래용 써니말대로 말씀이지나치시네요,21,5,"이희진, 장나라에 격한 선전포고 “최진혁 건드리지 마!”","재생수 106,054",406,87,22
1374,앙,이분도 정상은 아닌듯 ..,22,0,"이희진, 장나라에 격한 선전포고 “최진혁 건드리지 마!”","재생수 106,054",406,87,22
1375,두산베이글,오써니 계속 아무사이 아니라고하는데 천우빈좋아한다고 왜그러는지,29,5,"이희진, 장나라에 격한 선전포고 “최진혁 건드리지 마!”","재생수 106,054",406,87,22
1376,두산베이글,장공주가 하는말 다 맞는데 꼭 써니가 천우빈 꼬셨다는 식으로 저러니까 비호감이지,29,3,"이희진, 장나라에 격한 선전포고 “최진혁 건드리지 마!”","재생수 106,054",406,87,22
1377,덮덮덮,아 몰라 이제 소진공주 안 불쌍해 나 지금 갈피못잡고 써니보려고 보는데 써니한테 이러면 나 안좋아해..공주..이제 천대장을 놓으십쇼..,34,0,"이희진, 장나라에 격한 선전포고 “최진혁 건드리지 마!”","재생수 106,054",406,87,22
1378,레스터시티,광고 진짜 너무한거 아니냐,11,0,"이희진, 장나라에 격한 선전포고 “최진혁 건드리지 마!”","재생수 106,054",406,87,22
