,nick,contents,recomm,unrecomm,title,play,like,reple_count,episode
705,ehdr****,아리공주 연기 잘해서 너무 예쁘네요 아리랑 써니 계속  자주 나왔으면 좋겠어요,39,0,"“그런 건 어른들이 할게” 장나라, 원망 배우려는 오아린에 ‘포옹’","재생수 428,175","2,928",165,17
706,슈라,아리 연기 잘해 ㅠㅠㅜㅜㅜ 이 장면 흐믓하다,42,0,"“그런 건 어른들이 할게” 장나라, 원망 배우려는 오아린에 ‘포옹’","재생수 428,175","2,928",165,17
707,Jun1013,아리 똑똑하네.. 귀여워라,34,0,"“그런 건 어른들이 할게” 장나라, 원망 배우려는 오아린에 ‘포옹’","재생수 428,175","2,928",165,17
708,보라kim,홍시가 왜여기서나와  ㅋ,29,0,"“그런 건 어른들이 할게” 장나라, 원망 배우려는 오아린에 ‘포옹’","재생수 428,175","2,928",165,17
709,왓더퍽,아이를 아이답게 만들어가는 황후마마~~~,58,0,"“그런 건 어른들이 할게” 장나라, 원망 배우려는 오아린에 ‘포옹’","재생수 428,175","2,928",165,17
710,왓더퍽,장나라 아리공주 넘나따뜻한데 마지막 신은경표정ㅋㅋㅋㅋㅋㅋㅋㅋㅋㅋㅋㅋ,46,0,"“그런 건 어른들이 할게” 장나라, 원망 배우려는 오아린에 ‘포옹’","재생수 428,175","2,928",165,17
711,박진성,신성록 표정 아 왜케 사랑스럽지 ...남자가봐도 설랜닥,50,1,"“그런 건 어른들이 할게” 장나라, 원망 배우려는 오아린에 ‘포옹’","재생수 428,175","2,928",165,17
712,romi****,신은경표정도 은근 귀엽단말야,45,1,"“그런 건 어른들이 할게” 장나라, 원망 배우려는 오아린에 ‘포옹’","재생수 428,175","2,928",165,17
713,연,아리 너무귀여워 진짜ㅜㅜㅠㅠㅠㅠㅠㅠㅠ연기도 너무 잘하공 ㅠㅠㅠㅠㅠ,35,0,"“그런 건 어른들이 할게” 장나라, 원망 배우려는 오아린에 ‘포옹’","재생수 428,175","2,928",165,17
714,MorethenWords,다른건 다 필요없소 아리공주의 행복한미래뿐,38,0,"“그런 건 어른들이 할게” 장나라, 원망 배우려는 오아린에 ‘포옹’","재생수 428,175","2,928",165,17
715,하하호호,아리공주 연말에 상 못받은거 아쉬움 ㅠㅠ,53,0,"“그런 건 어른들이 할게” 장나라, 원망 배우려는 오아린에 ‘포옹’","재생수 428,175","2,928",165,17
716,하하호호,근데 태그에 오아린나이 오아린학교는 뭐임?,28,0,"“그런 건 어른들이 할게” 장나라, 원망 배우려는 오아린에 ‘포옹’","재생수 428,175","2,928",165,17
717,유리,개과천선햇다한들  살인들을 자행햇다는게  드라마상의팩트    음모에빠진오써니를  대신해서 죽을듯함  아니면 크게다치거나  매일먹는음식도 독을탄건아닐까? 아님 병을얻은상태일지도   저런부모밑이면 온전한정신으로 남기힘들엇을듯  그나마  할마마마가 온정을 갈치는 그런사람이었는데   ...그.래!서  할마마는  누가죽인거임?   이엘리야가 정신이나가보이던데  현승인지 앤인지보고나믄  정신미친거돌아오려나,16,6,"“그런 건 어른들이 할게” 장나라, 원망 배우려는 오아린에 ‘포옹’","재생수 428,175","2,928",165,17
718,김예원,으아 어떡해ㅠㅜㅜㅜㅠ이혁이 좋아지고있어ㅠㅠㅜㅜ,37,2,"“그런 건 어른들이 할게” 장나라, 원망 배우려는 오아린에 ‘포옹’","재생수 428,175","2,928",165,17
719,star****,요즘은 아리공쥬보는맛에 이드라마본다 진짜,34,0,"“그런 건 어른들이 할게” 장나라, 원망 배우려는 오아린에 ‘포옹’","재생수 428,175","2,928",165,17
720,킹갓롯데,아리공듀 귀여워 귀여워ㅜㅜㅜㅜ,31,0,"“그런 건 어른들이 할게” 장나라, 원망 배우려는 오아린에 ‘포옹’","재생수 428,175","2,928",165,17
721,후늬,"아리와 오싸니 모습 뒤에서 흐뭇하게 보는 이혁, 그 밖에 므흣한 시청자, 그 위에 찡긋거리는 순옥.",40,0,"“그런 건 어른들이 할게” 장나라, 원망 배우려는 오아린에 ‘포옹’","재생수 428,175","2,928",165,17
722,illumination,"아리아버님, 오써니를 전쩍으로 믿으셔야 합니다.....근데 진짜 이러다 이혁이 태후한테서 써니 구하다 어찌되려나ㅜㅜ그때 이장면도 회상으로 나오면 슬플 듯. 아니길 바라요 수녹킴",38,0,"“그런 건 어른들이 할게” 장나라, 원망 배우려는 오아린에 ‘포옹’","재생수 428,175","2,928",165,17
723,하하호호,써니대사 정말 따뜻하다...누굴미워하고 의심하고 원망하는거 안했으면 좋겠대.. 그런건 어른들이하겠다고.. 되려 미안하대,49,0,"“그런 건 어른들이 할게” 장나라, 원망 배우려는 오아린에 ‘포옹’","재생수 428,175","2,928",165,17
724,율하,이혁 회개해서 써니랑 오순도순 아리 키우면 안 되나.. 안 되겠지ㅠㅠ 너무 악연이라ㅠㅠ 이혁 왜 멋진데ㅠㅠ,37,0,"“그런 건 어른들이 할게” 장나라, 원망 배우려는 오아린에 ‘포옹’","재생수 428,175","2,928",165,17
725,유랑,아리 캐스팅한 건 진짜 신의 한수다...,56,1,"“그런 건 어른들이 할게” 장나라, 원망 배우려는 오아린에 ‘포옹’","재생수 428,175","2,928",165,17
726,머랑둥이,황제 얼굴은 잘못없어......,48,0,"“그런 건 어른들이 할게” 장나라, 원망 배우려는 오아린에 ‘포옹’","재생수 428,175","2,928",165,17
727,레몬에이드,이혁써니아리 이렇게 3가족 행복하면 좋겠다ㅠㅜ,47,0,"“그런 건 어른들이 할게” 장나라, 원망 배우려는 오아린에 ‘포옹’","재생수 428,175","2,928",165,17
728,방,네캐 영상 상위권 황품이 다 차지했넼ㅋㅋㅋㅋ,33,0,"“그런 건 어른들이 할게” 장나라, 원망 배우려는 오아린에 ‘포옹’","재생수 428,175","2,928",165,17
729,떵우볼은밤하늘,진짜 졸귀ㅠㅠㅠㅠㅠㅠㅠㅠ 으아아아아아 귀여워,29,0,"“그런 건 어른들이 할게” 장나라, 원망 배우려는 오아린에 ‘포옹’","재생수 428,175","2,928",165,17
730,대폭발,"이혁도 불쌍하다.,도라이엄마 만나서...",38,0,"“그런 건 어른들이 할게” 장나라, 원망 배우려는 오아린에 ‘포옹’","재생수 428,175","2,928",165,17
731,누리,02:54 태후 표정 졸커ㅋㅋ도둑이 제발 저린 표정ㅋㅋ그나저나 아리는 태후의 영악함을 좋은 쪽으로 닮았고 좋아하는 사람한테 직진하고 간이고 쓸개고 빼주려는 모습은 아바마마 이혁 닮았나 봄ㅋ. 근데 쿠키 자꾸 보니 땡기네요 이 새벽에...,37,0,"“그런 건 어른들이 할게” 장나라, 원망 배우려는 오아린에 ‘포옹’","재생수 428,175","2,928",165,17
732,앙덕,공주목색깔왜저럼,7,4,"“그런 건 어른들이 할게” 장나라, 원망 배우려는 오아린에 ‘포옹’","재생수 428,175","2,928",165,17
733,smal****,신은경 표정 개얄밉네,16,0,"“그런 건 어른들이 할게” 장나라, 원망 배우려는 오아린에 ‘포옹’","재생수 428,175","2,928",165,17
734,두바퀴,아리공주 교육습득이 참 빠르네요갈수록 이쁜짓하네ㅎ,35,0,"“그런 건 어른들이 할게” 장나라, 원망 배우려는 오아린에 ‘포옹’","재생수 428,175","2,928",165,17
735,dhkd****,써니랑 왕식이는 각각 남의 자식을 친부모보다 살뜰히 챙겨네.,29,1,"“그런 건 어른들이 할게” 장나라, 원망 배우려는 오아린에 ‘포옹’","재생수 428,175","2,928",165,17
736,별,써니이혁아리랑 행복하게 살자,28,0,"“그런 건 어른들이 할게” 장나라, 원망 배우려는 오아린에 ‘포옹’","재생수 428,175","2,928",165,17
737,수연님,아리와 써니 투샷 너무 좋다 ㅋ,31,1,"“그런 건 어른들이 할게” 장나라, 원망 배우려는 오아린에 ‘포옹’","재생수 428,175","2,928",165,17
738,뿡뿡이방구대장,혁이 불쌍...  또롸이,25,1,"“그런 건 어른들이 할게” 장나라, 원망 배우려는 오아린에 ‘포옹’","재생수 428,175","2,928",165,17
739,뀨,폐하 얼굴이 치트키다 ..,37,0,"“그런 건 어른들이 할게” 장나라, 원망 배우려는 오아린에 ‘포옹’","재생수 428,175","2,928",165,17
740,인서멜로디,아리공주 진짜 아역상 받았어야햇는데...,70,1,"“그런 건 어른들이 할게” 장나라, 원망 배우려는 오아린에 ‘포옹’","재생수 428,175","2,928",165,17
741,달빛창가에써니,아이에게 증오심이 자라지 않도록 가르치는 황후죠,64,0,"“그런 건 어른들이 할게” 장나라, 원망 배우려는 오아린에 ‘포옹’","재생수 428,175","2,928",165,17
742,스티븐호킹,아리공주를 바르게 가르치는 황후를 보고 황제가 더욱 믿음을 가지네,67,0,"“그런 건 어른들이 할게” 장나라, 원망 배우려는 오아린에 ‘포옹’","재생수 428,175","2,928",165,17
743,카이트,아리공주 나중에 유산얘기 꼭해줘요..어마마께,67,2,"“그런 건 어른들이 할게” 장나라, 원망 배우려는 오아린에 ‘포옹’","재생수 428,175","2,928",165,17
744,후늬,아리야 절대 변하면 안된다고 순옥과 다짐해다오.,72,1,"“그런 건 어른들이 할게” 장나라, 원망 배우려는 오아린에 ‘포옹’","재생수 428,175","2,928",165,17
745,의유당,ㅋㅋㅋㅋㅋㅋㅋㅋ태후 놀란표정뭐임ㅋㅋㅋㅋㅋㅋㅋ,44,1,"“그런 건 어른들이 할게” 장나라, 원망 배우려는 오아린에 ‘포옹’","재생수 428,175","2,928",165,17
746,수연님,나라짱 ❤️아리,40,1,"“그런 건 어른들이 할게” 장나라, 원망 배우려는 오아린에 ‘포옹’","재생수 428,175","2,928",165,17
747,김서현,저도 써니랑 이혁이잘됫우면 좋겟어요 제발요 작가님!!!!!!! 써니❤️이혁,50,2,"“그런 건 어른들이 할게” 장나라, 원망 배우려는 오아린에 ‘포옹’","재생수 428,175","2,928",165,17
748,훗,맞아 아리공주가 오써니한테 유산말해줘야하는데 흠.. 아리공주가 말해서 알게되는게 아닐수도있겠다싶어용,44,0,"“그런 건 어른들이 할게” 장나라, 원망 배우려는 오아린에 ‘포옹’","재생수 428,175","2,928",165,17
749,ㅅㅎ,장나라랑 아리공주 나올때 따뜻한 분위기 너무 좋다,51,0,"“그런 건 어른들이 할게” 장나라, 원망 배우려는 오아린에 ‘포옹’","재생수 428,175","2,928",165,17
750,훗,아리공주❤️황후마마 이 케미도 못잃어!,40,0,"“그런 건 어른들이 할게” 장나라, 원망 배우려는 오아린에 ‘포옹’","재생수 428,175","2,928",165,17
751,8000,이혁이 황후한테 웃어줄때 심쿵❤,40,1,"“그런 건 어른들이 할게” 장나라, 원망 배우려는 오아린에 ‘포옹’","재생수 428,175","2,928",165,17
752,ehdr****,써니와 아리공주는 사랑이네요,39,0,"“그런 건 어른들이 할게” 장나라, 원망 배우려는 오아린에 ‘포옹’","재생수 428,175","2,928",165,17
753,8000,셋이 다정한 모습 또 볼 수 있을까 ㅜㅜㅜ 이혁❤써니,32,3,"“그런 건 어른들이 할게” 장나라, 원망 배우려는 오아린에 ‘포옹’","재생수 428,175","2,928",165,17
754,유블리,이혁하구 써니 하구 이뤘으면 좋겠당ㅜ,33,1,"“그런 건 어른들이 할게” 장나라, 원망 배우려는 오아린에 ‘포옹’","재생수 428,175","2,928",165,17
755,북카페,황후~아리~~ 넘 귀요워요,30,1,"“그런 건 어른들이 할게” 장나라, 원망 배우려는 오아린에 ‘포옹’","재생수 428,175","2,928",165,17
756,지은S,역시 우리 아리가 핵싸이다!,34,0,"“그런 건 어른들이 할게” 장나라, 원망 배우려는 오아린에 ‘포옹’","재생수 428,175","2,928",165,17
757,Healthy,아린이 연기 천재야..♡ 나라짱과 모녀케미 잘어울려,41,0,"“그런 건 어른들이 할게” 장나라, 원망 배우려는 오아린에 ‘포옹’","재생수 428,175","2,928",165,17
758,낫토,아리공주 황실에 있어서 그런가 처세술에 어른만큼 영악한아이인데 써니랑 있을때 오구오구하는거보면 많이 좋아하는게 느껴짐,61,0,"“그런 건 어른들이 할게” 장나라, 원망 배우려는 오아린에 ‘포옹’","재생수 428,175","2,928",165,17
759,SYSJDW,우리 혁ㅠㅠ 저 아련한 눈빛 좀 보세요ㅠㅠㅠㅠㅠ 짠내 폭발,41,1,"“그런 건 어른들이 할게” 장나라, 원망 배우려는 오아린에 ‘포옹’","재생수 428,175","2,928",165,17
760,대박사건,훈훈타임❤️ 진짜 점점 변해가는구나!!! 써니 심성이 고와서 아리가 그대로 닮아가는거 너무훈훈해,52,1,"“그런 건 어른들이 할게” 장나라, 원망 배우려는 오아린에 ‘포옹’","재생수 428,175","2,928",165,17
761,쏭지,이혁이랑 아리 졸커,34,1,"“그런 건 어른들이 할게” 장나라, 원망 배우려는 오아린에 ‘포옹’","재생수 428,175","2,928",165,17
762,젝슨갓젝슨,진짜 장나라덕분에 아리공주 점점변해간다,54,1,"“그런 건 어른들이 할게” 장나라, 원망 배우려는 오아린에 ‘포옹’","재생수 428,175","2,928",165,17
763,별난bella,아리공주 진짜 똑똑하다 귀엽구 똑똑하고 이쁘고 아리공주 짱입니다요~ 그 뒤에서 써니와 아리공주를 바라보는 이혁까지 너무 좋다~! 난 무조건 이혁파얏!!,40,1,"“그런 건 어른들이 할게” 장나라, 원망 배우려는 오아린에 ‘포옹’","재생수 428,175","2,928",165,17
764,젝슨갓젝슨,아리공주랑 황후마마 너무 마음이 예쁘고ㅠㅠ 훈훈해,34,1,"“그런 건 어른들이 할게” 장나라, 원망 배우려는 오아린에 ‘포옹’","재생수 428,175","2,928",165,17
765,엉,아리가 이렇게 좋아하는데 .. 우리 그냥 이혁 벌 받고 나와서 써니 이혁 아리 셋이서 행복하게 살자 .. 우리 아리 여황제 되는거 이혁 써니가 다 봐야지 ㅠ ㅠ 안 될 까 요,47,1,"“그런 건 어른들이 할게” 장나라, 원망 배우려는 오아린에 ‘포옹’","재생수 428,175","2,928",165,17
766,크봇,아리공주너무귀엽고 써니너무예쁘고 ㅎㅎ 아리공주똑똑해!! 둘이 같이나오면 너무재밌어ㅋㅋ,30,1,"“그런 건 어른들이 할게” 장나라, 원망 배우려는 오아린에 ‘포옹’","재생수 428,175","2,928",165,17
767,들쥐,신은경 표정 모얔ㅋㅋㅋㅋㅋ기기,25,0,"“그런 건 어른들이 할게” 장나라, 원망 배우려는 오아린에 ‘포옹’","재생수 428,175","2,928",165,17
768,신은정배우는 예쁘다,아리공주 써니황후한테 사랑 듬뿍 마니마니받아서 잘 성장해나가길 바래용^^,32,0,"“그런 건 어른들이 할게” 장나라, 원망 배우려는 오아린에 ‘포옹’","재생수 428,175","2,928",165,17
769,SOFA,써니가 아리 사랑 듬뿍듬뿍 줘서 아리도 많이 변하길 바래요,37,0,"“그런 건 어른들이 할게” 장나라, 원망 배우려는 오아린에 ‘포옹’","재생수 428,175","2,928",165,17
770,곰이 되고픈 아이,아리야 유산이야기도 나중에 꼭 해줘야돼!!,37,0,"“그런 건 어른들이 할게” 장나라, 원망 배우려는 오아린에 ‘포옹’","재생수 428,175","2,928",165,17
771,Masterpiece,진정한 엄마는 서강희가 아니라 오써니예요,42,0,"“그런 건 어른들이 할게” 장나라, 원망 배우려는 오아린에 ‘포옹’","재생수 428,175","2,928",165,17
772,준S,나왕식하고의 로맨스보단...폐하가 어울리는 듯...ㅜㅜ,46,3,"“그런 건 어른들이 할게” 장나라, 원망 배우려는 오아린에 ‘포옹’","재생수 428,175","2,928",165,17
773,람뽀,이혁 아빠 다 됐네ㅎㅎㅎㅎ,44,1,"“그런 건 어른들이 할게” 장나라, 원망 배우려는 오아린에 ‘포옹’","재생수 428,175","2,928",165,17
774,승연아빠,왜 수요일날밤 10시냐...ㅋㅋ어제 결방이였으면 분량을채워야지...참ㅋ ㅋㅋ,24,0,"“그런 건 어른들이 할게” 장나라, 원망 배우려는 오아린에 ‘포옹’","재생수 428,175","2,928",165,17
775,대학생,저걸 말로 표현하라고,29,0,"“그런 건 어른들이 할게” 장나라, 원망 배우려는 오아린에 ‘포옹’","재생수 428,175","2,928",165,17
776,Yoon,아 이혁 ㅠㅠㅠㅠㅠ 진짜 짠내나ㅠㅠㅠㅠ 어떡해ㅠㅠㅠㅠㅠㅠㅠ 하,25,1,"“그런 건 어른들이 할게” 장나라, 원망 배우려는 오아린에 ‘포옹’","재생수 428,175","2,928",165,17
777,후아후아,아리❤황후를 흐뭇하게 바라보는 혁이..,33,1,"“그런 건 어른들이 할게” 장나라, 원망 배우려는 오아린에 ‘포옹’","재생수 428,175","2,928",165,17
778,별셩,아리 덕에 힌트 알아내구ㅠㅠㅠ아리랑 써니황후 더 돈독해져서 좋다ㅠㅠ,940,7,"“그런 건 어른들이 할게” 장나라, 원망 배우려는 오아린에 ‘포옹’","재생수 428,175","2,928",165,17
779,H산드라H,저게 진짜 엄마지ㅜㅜ 저렇게 하는 게 진짜 엄마인 거지ㅠㅠ,38,0,"“그런 건 어른들이 할게” 장나라, 원망 배우려는 오아린에 ‘포옹’","재생수 428,175","2,928",165,17
780,아람닻별,오늘 아리 없었음 어쩔뻔했냐ㅠㅜ,27,0,"“그런 건 어른들이 할게” 장나라, 원망 배우려는 오아린에 ‘포옹’","재생수 428,175","2,928",165,17
781,es57****,미쳐 아리공주 똑똑한거봐ㅋㅋ,33,0,"“그런 건 어른들이 할게” 장나라, 원망 배우려는 오아린에 ‘포옹’","재생수 428,175","2,928",165,17
782,파란하늘,아리똑똑해..써니랑 아리 갈라놓지마ㅠㅠ 이혁속마음 아..좀빨리 깨닫지... 지킬겁니다 좋다ㅠㅠ,986,3,"“그런 건 어른들이 할게” 장나라, 원망 배우려는 오아린에 ‘포옹’","재생수 428,175","2,928",165,17
783,별난bella,아리공주 진짜 똑똑하다 귀엽구 똑똑하고 이쁘고 아리공주 짱입니다요~ 그 뒤에서 써니와 아리공주를 바라보는 이혁까지 너무 좋다~! 난 무조건 이혁파얏!!,40,1,"“그런 건 어른들이 할게” 장나라, 원망 배우려는 오아린에 ‘포옹’","재생수 428,175","2,928",165,17
784,젝슨갓젝슨,아리공주랑 황후마마 너무 마음이 예쁘고ㅠㅠ 훈훈해,34,1,"“그런 건 어른들이 할게” 장나라, 원망 배우려는 오아린에 ‘포옹’","재생수 428,175","2,928",165,17
785,엉,아리가 이렇게 좋아하는데 .. 우리 그냥 이혁 벌 받고 나와서 써니 이혁 아리 셋이서 행복하게 살자 .. 우리 아리 여황제 되는거 이혁 써니가 다 봐야지 ㅠ ㅠ 안 될 까 요,47,1,"“그런 건 어른들이 할게” 장나라, 원망 배우려는 오아린에 ‘포옹’","재생수 428,175","2,928",165,17
786,크봇,아리공주너무귀엽고 써니너무예쁘고 ㅎㅎ 아리공주똑똑해!! 둘이 같이나오면 너무재밌어ㅋㅋ,30,1,"“그런 건 어른들이 할게” 장나라, 원망 배우려는 오아린에 ‘포옹’","재생수 428,175","2,928",165,17
787,들쥐,신은경 표정 모얔ㅋㅋㅋㅋㅋ기기,25,0,"“그런 건 어른들이 할게” 장나라, 원망 배우려는 오아린에 ‘포옹’","재생수 428,175","2,928",165,17
788,신은정배우는 예쁘다,아리공주 써니황후한테 사랑 듬뿍 마니마니받아서 잘 성장해나가길 바래용^^,32,0,"“그런 건 어른들이 할게” 장나라, 원망 배우려는 오아린에 ‘포옹’","재생수 428,175","2,928",165,17
789,SOFA,써니가 아리 사랑 듬뿍듬뿍 줘서 아리도 많이 변하길 바래요,37,0,"“그런 건 어른들이 할게” 장나라, 원망 배우려는 오아린에 ‘포옹’","재생수 428,175","2,928",165,17
790,곰이 되고픈 아이,아리야 유산이야기도 나중에 꼭 해줘야돼!!,37,0,"“그런 건 어른들이 할게” 장나라, 원망 배우려는 오아린에 ‘포옹’","재생수 428,175","2,928",165,17
791,Masterpiece,진정한 엄마는 서강희가 아니라 오써니예요,42,0,"“그런 건 어른들이 할게” 장나라, 원망 배우려는 오아린에 ‘포옹’","재생수 428,175","2,928",165,17
792,준S,나왕식하고의 로맨스보단...폐하가 어울리는 듯...ㅜㅜ,46,3,"“그런 건 어른들이 할게” 장나라, 원망 배우려는 오아린에 ‘포옹’","재생수 428,175","2,928",165,17
793,람뽀,이혁 아빠 다 됐네ㅎㅎㅎㅎ,44,1,"“그런 건 어른들이 할게” 장나라, 원망 배우려는 오아린에 ‘포옹’","재생수 428,175","2,928",165,17
794,승연아빠,왜 수요일날밤 10시냐...ㅋㅋ어제 결방이였으면 분량을채워야지...참ㅋ ㅋㅋ,24,0,"“그런 건 어른들이 할게” 장나라, 원망 배우려는 오아린에 ‘포옹’","재생수 428,175","2,928",165,17
795,대학생,저걸 말로 표현하라고,29,0,"“그런 건 어른들이 할게” 장나라, 원망 배우려는 오아린에 ‘포옹’","재생수 428,175","2,928",165,17
796,Yoon,아 이혁 ㅠㅠㅠㅠㅠ 진짜 짠내나ㅠㅠㅠㅠ 어떡해ㅠㅠㅠㅠㅠㅠㅠ 하,25,1,"“그런 건 어른들이 할게” 장나라, 원망 배우려는 오아린에 ‘포옹’","재생수 428,175","2,928",165,17
797,후아후아,아리❤황후를 흐뭇하게 바라보는 혁이..,33,1,"“그런 건 어른들이 할게” 장나라, 원망 배우려는 오아린에 ‘포옹’","재생수 428,175","2,928",165,17
798,별셩,아리 덕에 힌트 알아내구ㅠㅠㅠ아리랑 써니황후 더 돈독해져서 좋다ㅠㅠ,940,7,"“그런 건 어른들이 할게” 장나라, 원망 배우려는 오아린에 ‘포옹’","재생수 428,175","2,928",165,17
799,H산드라H,저게 진짜 엄마지ㅜㅜ 저렇게 하는 게 진짜 엄마인 거지ㅠㅠ,38,0,"“그런 건 어른들이 할게” 장나라, 원망 배우려는 오아린에 ‘포옹’","재생수 428,175","2,928",165,17
800,아람닻별,오늘 아리 없었음 어쩔뻔했냐ㅠㅜ,27,0,"“그런 건 어른들이 할게” 장나라, 원망 배우려는 오아린에 ‘포옹’","재생수 428,175","2,928",165,17
801,es57****,미쳐 아리공주 똑똑한거봐ㅋㅋ,33,0,"“그런 건 어른들이 할게” 장나라, 원망 배우려는 오아린에 ‘포옹’","재생수 428,175","2,928",165,17
802,파란하늘,아리똑똑해..써니랑 아리 갈라놓지마ㅠㅠ 이혁속마음 아..좀빨리 깨닫지... 지킬겁니다 좋다ㅠㅠ,986,3,"“그런 건 어른들이 할게” 장나라, 원망 배우려는 오아린에 ‘포옹’","재생수 428,175","2,928",165,17
803,별셩,아리 너무귀여워ㅠㅠㅠㅠ,18,0,"“그런 건 어른들이 할게” 장나라, 원망 배우려는 오아린에 ‘포옹’","재생수 428,175","2,928",165,17
804,두듄두듄,아리공주 아리가또,18,0,"“그런 건 어른들이 할게” 장나라, 원망 배우려는 오아린에 ‘포옹’","재생수 428,175","2,928",165,17
805,황유림,써니 이혁 아리공주 이렇게 계속 쭉 갔으면 좋겠다ㅠㅠ,799,4,"“그런 건 어른들이 할게” 장나라, 원망 배우려는 오아린에 ‘포옹’","재생수 428,175","2,928",165,17
806,준희,"태후마마가 목걸이 가져가셨다는 이 말이 복선인거 같다.첫화에 나왔던 시체는 태후인거같고 나중에 이혁은 써니 대신 죽고 민유라랑 강주승은 죗값 다 치루고 다 포기하고 원래대로 둘이 살것같고, 아리는 여황제 되고 써니랑 천우빈은 동식이랑 서현황후 아버지랑 그냥 소소하게 행복하게 살것같다.",22,2,"“그런 건 어른들이 할게” 장나라, 원망 배우려는 오아린에 ‘포옹’","재생수 428,175","2,928",165,17
807,박수진,아리공주 너무 귀엽다ㅜㅜ,1189,6,"“그런 건 어른들이 할게” 장나라, 원망 배우려는 오아린에 ‘포옹’","재생수 428,175","2,928",165,17
808,쵸코우유,카톡개ㅋㅋㅋㅋ표정보소ㅋㅋㅋㅋ 아주 푹 빠져서 해어나오지 못하겠어 표정임ㅋㅋ,3422,30,"“그런 건 어른들이 할게” 장나라, 원망 배우려는 오아린에 ‘포옹’","재생수 428,175","2,928",165,17
809,데헷,이야 폐하얼굴에 취하고간다,1380,18,"“그런 건 어른들이 할게” 장나라, 원망 배우려는 오아린에 ‘포옹’","재생수 428,175","2,928",165,17
810,은돌이,ㅠㅠㅠㅠㅠ 똑부러지다 공쥬,1698,7,"“그런 건 어른들이 할게” 장나라, 원망 배우려는 오아린에 ‘포옹’","재생수 428,175","2,928",165,17
811,정다현,갑자기 이혁파가 되고 싶어진다,1607,26,"“그런 건 어른들이 할게” 장나라, 원망 배우려는 오아린에 ‘포옹’","재생수 428,175","2,928",165,17
812,데헷,이야 나라언니 애기랑 같이 있어도 전혀 늙어 보이지가 않아,862,5,"“그런 건 어른들이 할게” 장나라, 원망 배우려는 오아린에 ‘포옹’","재생수 428,175","2,928",165,17
813,ChoiAhIn,아리는 정말 차기 황제되자 똑똑하고 뭐든 습득력도 빠르구 무엇보다 귀여웡ㅋㅋㅋㅋㅋㅋ,2252,10,"“그런 건 어른들이 할게” 장나라, 원망 배우려는 오아린에 ‘포옹’","재생수 428,175","2,928",165,17
